{
  "$schema": "https://packageurl.org/schemas/purl-type-definition.schema-1.0.json",
  "$id": "https://packageurl.org/types/chrome-definition.json",
  "type": "chrome",
  "type_name": "chrome",
  "description": "Chrome Browser Extensions (extensions from the official Chrome Webstore)",
  "repository": {
    "use_repository": true,
    "default_repository_url": "https://https://chromewebstore.google.com/",
    "note": "There is no documented API, only a sitemap and 'updatecheck' endpoints."
  },
  "namespace_definition": {
    "requirement": "prohibited",
    "note": "There is no namespace"
  },
  "name_definition": {
    "native_name": "version",
    "case_sensitive": false,
    "note": "The name is a 32 characters a-z and is case insensitive"
  },
  "version_definition": {
    "native_name": "version",
    "requirement": "optional",
    "note": "The chrome extension version is semver-like but 1-4 segments"
  },
  "note": "There is currently no documented API for querying different versions of a package - there only seems to be responses on the latest version. To this end the version component of a chrome purl can be optional.",
  "examples": [
    "pkg:chrome/hlepfoohegkhhmjieoechaddaejaokhf@25.7.1",
    "pkg:chrome/dncgedbnidfkppmdgfgidcepclnokpkb@6.0.2.3611",
    "pkg:chrome/kanfjhdeebkfgkbmnfknhejpadhlmiab@0.6",
    "pkg:chrome/dlpngalgnefjeiefhmpklpfiohadpglk@1",
    "pkg:chrome/dlpngalgnefjeiefhmpklpfiohadpglk"
  ]
}
