{
  "$schema": "https://packageurl.org/schemas/purl-type-definition.schema-1.1.json",
  "$id": "https://packageurl.org/types/spack-definition.json",
  "type": "spack",
  "type_name": "spack",
  "description": "spack packages",
  "repository": {
    "use_repository": true,
    "default_repository_url": "https://github.com/spack/spack-packages",
    "note": "The default repository for spack packages"
  },
  "namespace_definition": {
    "requirement": "required",
    "note": "The spack namespace as given by `spack find -N`"
  },
  "name_definition": {
    "requirement": "required",
    "note": "The package's name"
  },
  "version_definition": {
    "requirement": "optional",
    "note": "The spack version using the standard version syntax (https://spack.readthedocs.io/en/latest/spec_syntax.html#version-specifier)"
  },
  "qualifiers_definition": [
    {
      "key": "daghash",
      "requirement": "optional",
      "description": "The spack hash of the installation as given by 'spack find -l'"
    }
  ],
  "examples": [
    "pkg:spack/builtin/zlib@1.3.2",
    "pkg:spack/mynamespace/gmake@4.4.1?daghash=os2kltnpbfyz7yxpdaoxtbzocsp223q3"
  ]
}
